{
  "schema_version": 1,
  "subject": "g13_acceptance_map_check",
  "symbolic_gate_key": "g13.wave.1.acceptance_map",
  "matrix_row": "G13.1",
  "wave": "G13.1",
  "numeric_step": 233,
  "source_ref": "G13_CONTRACT G-G13-2/§4.2;G13_ACCEPTANCE_MAP.md §1/§2/§4/§5;2026-08-18 G13 立项前调研报告 P0 清单 M-a~M-e",
  "host_section_pass": true,
  "device_section_state": "not_applicable",
  "required_gates": [],
  "extra_facts": [
    {
      "id": "coverage_p0_set",
      "status": "PASS",
      "detail": "got ['M-a', 'M-b', 'M-c', 'M-d', 'M-e']; expect ['M-a', 'M-b', 'M-c', 'M-d', 'M-e']"
    },
    {
      "id": "coverage_p1_empty",
      "status": "PASS",
      "detail": "§2 零 go P1 空集（G13.1 字面）"
    },
    {
      "id": "row_M-a",
      "status": "PASS",
      "detail": "ok"
    },
    {
      "id": "two_way_M-a",
      "status": "PASS",
      "detail": "ok"
    },
    {
      "id": "row_M-b",
      "status": "PASS",
      "detail": "ok"
    },
    {
      "id": "two_way_M-b",
      "status": "PASS",
      "detail": "ok"
    },
    {
      "id": "row_M-c",
      "status": "PASS",
      "detail": "ok"
    },
    {
      "id": "two_way_M-c",
      "status": "PASS",
      "detail": "ok"
    },
    {
      "id": "row_M-d",
      "status": "PASS",
      "detail": "ok"
    },
    {
      "id": "two_way_M-d",
      "status": "PASS",
      "detail": "ok"
    },
    {
      "id": "row_M-e",
      "status": "PASS",
      "detail": "ok"
    },
    {
      "id": "two_way_M-e",
      "status": "PASS",
      "detail": "ok"
    }
  ],
  "subjects": [],
  "checks": {
    "all_required_gates_pass": true,
    "all_extra_facts_pass": true,
    "all_subjects_pass": true,
    "aggregate_read_only": true
  },
  "evidence_level": "measured_local",
  "run_url": "",
  "timestamp": "20260819T114725Z",
  "environment": {
    "os": "Windows-11-10.0.28120-SP0",
    "python_version": "3.12.1",
    "cargo_version": "cargo 1.93.1 (083ac5135 2025-12-15)",
    "rustc_version": "rustc 1.93.1 (01f6ddf75 2026-02-11)"
  },
  "notes": "G13.1 治理门——验收映射覆盖/空行/双向命名空间一致性：5 P0（M-a vendor 超分接入/M-b 自研 TSR device 化/M-c UE5 超分双端对拍/M-d UE Lumen GI 对照/M-e 回归门+漂移监控）闭集全等 + §2 零 go P1 空集 + key/脚本/schema 单一命名空间同 slug + numeric_step 全列 post-interlock 字面零预占 + MAP §1 ↔ CONTRACT §4.2 双向逐字一致（G13 无独立 CI_GATES）；本门 PASS 只表示映射完整，不表示任何 P0 能力已实现"
}
